{
  "kind": "cineweave_codex_prompt_hypothesis",
  "worldId": "world-cloud-dynasty",
  "sourceInput": "分析参考图中仙气来自哪些可验证的视觉机制。",
  "skillReceipt": {
    "repository": "https://github.com/owner/repository",
    "ref": "v0.2.0",
    "commit": "0123456789abcdef0123456789abcdef01234567",
    "contentHash": "sha256:aaaaaaaaaaaaaaaaaaaaaaaaaaaaaaaaaaaaaaaaaaaaaaaaaaaaaaaaaaaaaaaa",
    "installedBy": "codex-environment",
    "environmentId": "codex-device-a",
    "usedAt": "2026-08-18T12:00:00.000Z"
  },
  "hypotheses": [
    {
      "hypothesisId": "hypothesis-cool-spill",
      "fragment": "单一冷色环境光从人物右后方进入，形成可识别的衣袖边缘分离；仙气来自方向性光与半透明织物的共同作用，而不是全局发光。",
      "category": "light",
      "confidence": "medium",
      "unknowns": ["实际色温", "光源高度"],
      "observationIds": ["observation-light-01"],
      "analysisRunId": "analysis-20260818-01",
      "modelSnapshot": "codex-image-analysis",
      "inputHash": "sha256:input-placeholder",
      "alternativeHypotheses": ["后期局部提亮造成边缘分离"]
    }
  ]
}
